{
  "$schema": "https://json-schema.org/draft/2020-12/schema",
  "$id": "https://scriptorium.local/schemas/artset-edits.schema.json",
  "title": "artset-edits",
  "description": "One household profile's private picture edits for one book (artsets/{user}/{book}/edits/edits.json). Each entry records a plate the reader hand-edited after publish: a replaced image (stored beside this file at the SAME relative paths as the bundle, e.g. images/web/plates/{plate_id}.webp) plus an editable caption. Additive and private per profile — it never touches the shared, immutable published bundle or pages/*.json (extends ADR-0014, the per-user art-set channel).",
  "type": "object",
  "additionalProperties": false,
  "required": ["book_id", "user_id", "source_revision", "plates"],
  "properties": {
    "book_id": {
      "description": "Permanent book identifier these edits belong to.",
      "type": "string",
      "pattern": "^(pg-[0-9]+|usr-[0-9a-f]{12})$"
    },
    "user_id": {
      "description": "Id of the household profile that owns these edits (matches users[].id).",
      "type": "string",
      "minLength": 1
    },
    "source_revision": {
      "description": "The book revision whose frozen plates these edits derived from; lets the reader flag an edit as stale after a later household re-publish (it is not auto-invalidated).",
      "type": "integer",
      "minimum": 1
    },
    "plates": {
      "description": "Map of plate_id (4-digit page id, or {page_id}-N for an extra same-page plate) to the edit for that plate.",
      "type": "object",
      "propertyNames": { "pattern": "^[0-9]{4}(-[0-9]+)?$" },
      "additionalProperties": {
        "type": "object",
        "additionalProperties": false,
        "required": ["caption", "prompt", "created"],
        "properties": {
          "caption": {
            "description": "The reader-edited caption shown under the plate (may be empty to show none). Overrides the page's auto-derived best_visual_beat for this profile only.",
            "type": "string"
          },
          "prompt": {
            "description": "The subject prompt the replacement image was generated from (pre-fills the editor on a re-edit).",
            "type": "string"
          },
          "seed": {
            "description": "The seed used, or null if the service randomized it.",
            "type": ["integer", "null"]
          },
          "denoise": {
            "description": "The img2img change amount in (0, 1] used against the previous image, or null for a from-scratch render.",
            "type": ["number", "null"]
          },
          "negative": {
            "description": "The negative prompt used for the replacement render (empty ⇒ the style's default negative was used).",
            "type": "string"
          },
          "style_id": {
            "description": "The illustration style the replacement was rendered under (a styles-catalog id, or 'custom' for a free-text look). Defaults to the style of the reader the edit was made from, so a comic-set page re-renders as comic.",
            "type": "string"
          },
          "custom_style": {
            "description": "Free-text look when style_id is 'custom' (ADR-0031); null/absent for a catalog style.",
            "type": ["string", "null"]
          },
          "model": {
            "description": "The base checkpoint (ComfyUI ckpt_name) the replacement was rendered with, or null for the imagegen service's configured default.",
            "type": ["string", "null"]
          },
          "quality": {
            "description": "The imagegen quality tier ('fast' | 'standard' | 'high') used, or null for the service default.",
            "type": ["string", "null"]
          },
          "reference_strength": {
            "description": "IP-Adapter likeness strength applied to the character reference photo, or null when no reference was used or the service default was accepted.",
            "type": ["number", "null"]
          },
          "created": {
            "description": "ISO-8601 UTC timestamp this edit was committed.",
            "type": "string",
            "format": "date-time"
          }
        }
      }
    }
  }
}
